{
  "schema_name": "us_short_cut5_pass2_feasibility_probe_summary",
  "schema_version": "1.1.0",
  "schema_ref": "schemas/us_short_cut5_pass2_feasibility_probe_summary.schema.json",
  "authorization_ref": "user_chat_20260701_cut5_pass2_feasibility_probe",
  "generated_at": "2026-07-01T10:31:44+00:00",
  "scope": {
    "market": "US",
    "route": "US-short",
    "batch": "batch5",
    "cut": "cut5_pass2_audit_gate_and_catalyst_data_layer",
    "purpose": "data_layer_feasibility_probe_only",
    "status": "feasibility_probe_completed_with_endpoint_errors",
    "provider_live_probe_performed": true,
    "raw_payload_storage_performed": true,
    "validation_only_raw_parse_performed": true,
    "binding_or_parser_built": false,
    "datahub_consumption_performed": false,
    "production_storage_performed": false,
    "full_market_call_performed": false,
    "yfinance_consumption_performed": false,
    "paid_tier_used": false,
    "broker_or_order_execution_performed": false,
    "manual_order_only": true,
    "ship_gate_or_live_normalized_evidence_claimed": false
  },
  "pre_execution_checks": {
    "user_authorization_confirmed": true,
    "provider_samples_gitignore_confirmed": true,
    "environment_precheck_passed": true,
    "fmp_api_key_present": true,
    "sec_user_agent_present": true,
    "massive_api_key_present": true,
    "budget_precheck_passed": true,
    "no_yfinance": true,
    "no_datahub": true,
    "no_full_market": true,
    "no_production_storage": true,
    "no_broker_or_order_execution": true
  },
  "environment": {
    "fmp_api_key_present": true,
    "fmp_api_key_source": "process",
    "sec_user_agent_present": true,
    "sec_user_agent_source": "process",
    "massive_api_key_present": true,
    "massive_api_key_source": "process",
    "secrets_logged": false
  },
  "storage": {
    "raw_payload_root": "provider_samples/us_short_cut5_pass2_feasibility_20260701/raw",
    "raw_payload_root_gitignored": true,
    "tracked_summary_path": "docs/us_short_cut5_pass2_feasibility_probe_summary_20260701.json",
    "tracked_summary_contains_raw_rows": false,
    "tracked_summary_contains_raw_payload": false,
    "secrets_in_summary": false,
    "request_urls_in_summary": false
  },
  "sample_universe": {
    "symbol_source": "cut5_feasibility_probe_fixed_active_only_sample",
    "symbols": [
      "AAPL",
      "MSFT",
      "NVDA"
    ],
    "active_symbols_only": true,
    "max_symbols": 3,
    "full_market_sample": false
  },
  "channels_probed": {
    "sec_submissions_form_families": [
      "S-1",
      "S-3",
      "424B",
      "S-8",
      "8-K",
      "10-K",
      "10-Q",
      "25-NSE",
      "form_4",
      "144",
      "SC_13G",
      "SC_13D"
    ],
    "fmp_catalyst_endpoint_families": [
      "earnings_surprises",
      "analyst_estimates",
      "grades"
    ],
    "massive_per_ticker_aggregates_symbol": "AAPL",
    "massive_reference_endpoint_families": [
      "massive_financials",
      "massive_news",
      "massive_earnings_analyst_probe"
    ]
  },
  "endpoint_call_budget": {
    "max_total_endpoint_calls": 24,
    "actual_total_endpoint_calls": 21,
    "retry_count": 0,
    "within_budget": true
  },
  "endpoint_results": [
    {
      "provider": "SEC",
      "endpoint_family": "company_tickers_mapping",
      "symbol": null,
      "status": "success",
      "http_status": 200,
      "error_type": null,
      "raw_sample_ref": "provider_samples/us_short_cut5_pass2_feasibility_20260701/raw/sec_edgar/_market/company_tickers_mapping.json",
      "raw_sample_ref_gitignored": true,
      "payload_shape": {
        "kind": "object",
        "row_count": null
      },
      "field_presence": {
        "ticker": true,
        "cik_str": true
      }
    },
    {
      "provider": "FMP",
      "endpoint_family": "earnings_surprises",
      "symbol": "AAPL",
      "status": "error",
      "http_status": 404,
      "error_type": "http_error",
      "raw_sample_ref": "provider_samples/us_short_cut5_pass2_feasibility_20260701/raw/financial_modeling_prep/AAPL/earnings_surprises.json",
      "raw_sample_ref_gitignored": true,
      "payload_shape": {
        "kind": "list",
        "row_count": 0
      },
      "field_presence": {
        "date": false,
        "symbol": false,
        "actualEarningResult": false,
        "estimatedEarning": false
      },
      "date_fields_present": {
        "date": false
      },
      "missing_required_fields": [
        "date",
        "symbol",
        "actualEarningResult",
        "estimatedEarning"
      ]
    },
    {
      "provider": "FMP",
      "endpoint_family": "analyst_estimates",
      "symbol": "AAPL",
      "status": "error",
      "http_status": 400,
      "error_type": "http_error",
      "raw_sample_ref": "provider_samples/us_short_cut5_pass2_feasibility_20260701/raw/financial_modeling_prep/AAPL/analyst_estimates.json",
      "raw_sample_ref_gitignored": true,
      "payload_shape": {
        "kind": "object",
        "row_count": null
      },
      "field_presence": {
        "date": false,
        "symbol": false,
        "estimatedRevenueAvg": false,
        "estimatedEpsAvg": false
      },
      "date_fields_present": {
        "date": false
      },
      "missing_required_fields": [
        "date",
        "symbol",
        "estimatedRevenueAvg",
        "estimatedEpsAvg"
      ]
    },
    {
      "provider": "FMP",
      "endpoint_family": "grades",
      "symbol": "AAPL",
      "status": "success",
      "http_status": 200,
      "error_type": null,
      "raw_sample_ref": "provider_samples/us_short_cut5_pass2_feasibility_20260701/raw/financial_modeling_prep/AAPL/grades.json",
      "raw_sample_ref_gitignored": true,
      "payload_shape": {
        "kind": "list",
        "row_count": 1771
      },
      "field_presence": {
        "symbol": true,
        "date": true,
        "gradingCompany": true,
        "newGrade": true,
        "previousGrade": true
      },
      "date_fields_present": {
        "date": true
      },
      "missing_required_fields": []
    },
    {
      "provider": "FMP",
      "endpoint_family": "earnings_surprises",
      "symbol": "MSFT",
      "status": "error",
      "http_status": 404,
      "error_type": "http_error",
      "raw_sample_ref": "provider_samples/us_short_cut5_pass2_feasibility_20260701/raw/financial_modeling_prep/MSFT/earnings_surprises.json",
      "raw_sample_ref_gitignored": true,
      "payload_shape": {
        "kind": "list",
        "row_count": 0
      },
      "field_presence": {
        "date": false,
        "symbol": false,
        "actualEarningResult": false,
        "estimatedEarning": false
      },
      "date_fields_present": {
        "date": false
      },
      "missing_required_fields": [
        "date",
        "symbol",
        "actualEarningResult",
        "estimatedEarning"
      ]
    },
    {
      "provider": "FMP",
      "endpoint_family": "analyst_estimates",
      "symbol": "MSFT",
      "status": "error",
      "http_status": 400,
      "error_type": "http_error",
      "raw_sample_ref": "provider_samples/us_short_cut5_pass2_feasibility_20260701/raw/financial_modeling_prep/MSFT/analyst_estimates.json",
      "raw_sample_ref_gitignored": true,
      "payload_shape": {
        "kind": "object",
        "row_count": null
      },
      "field_presence": {
        "date": false,
        "symbol": false,
        "estimatedRevenueAvg": false,
        "estimatedEpsAvg": false
      },
      "date_fields_present": {
        "date": false
      },
      "missing_required_fields": [
        "date",
        "symbol",
        "estimatedRevenueAvg",
        "estimatedEpsAvg"
      ]
    },
    {
      "provider": "FMP",
      "endpoint_family": "grades",
      "symbol": "MSFT",
      "status": "success",
      "http_status": 200,
      "error_type": null,
      "raw_sample_ref": "provider_samples/us_short_cut5_pass2_feasibility_20260701/raw/financial_modeling_prep/MSFT/grades.json",
      "raw_sample_ref_gitignored": true,
      "payload_shape": {
        "kind": "list",
        "row_count": 939
      },
      "field_presence": {
        "symbol": true,
        "date": true,
        "gradingCompany": true,
        "newGrade": true,
        "previousGrade": true
      },
      "date_fields_present": {
        "date": true
      },
      "missing_required_fields": []
    },
    {
      "provider": "FMP",
      "endpoint_family": "earnings_surprises",
      "symbol": "NVDA",
      "status": "error",
      "http_status": 404,
      "error_type": "http_error",
      "raw_sample_ref": "provider_samples/us_short_cut5_pass2_feasibility_20260701/raw/financial_modeling_prep/NVDA/earnings_surprises.json",
      "raw_sample_ref_gitignored": true,
      "payload_shape": {
        "kind": "list",
        "row_count": 0
      },
      "field_presence": {
        "date": false,
        "symbol": false,
        "actualEarningResult": false,
        "estimatedEarning": false
      },
      "date_fields_present": {
        "date": false
      },
      "missing_required_fields": [
        "date",
        "symbol",
        "actualEarningResult",
        "estimatedEarning"
      ]
    },
    {
      "provider": "FMP",
      "endpoint_family": "analyst_estimates",
      "symbol": "NVDA",
      "status": "error",
      "http_status": 400,
      "error_type": "http_error",
      "raw_sample_ref": "provider_samples/us_short_cut5_pass2_feasibility_20260701/raw/financial_modeling_prep/NVDA/analyst_estimates.json",
      "raw_sample_ref_gitignored": true,
      "payload_shape": {
        "kind": "object",
        "row_count": null
      },
      "field_presence": {
        "date": false,
        "symbol": false,
        "estimatedRevenueAvg": false,
        "estimatedEpsAvg": false
      },
      "date_fields_present": {
        "date": false
      },
      "missing_required_fields": [
        "date",
        "symbol",
        "estimatedRevenueAvg",
        "estimatedEpsAvg"